{
  "schema_version": "1.1.0",
  "id": "OVR_SPBU_HOST_DOCUMENTS",
  "university_id": "UNIV_SPBU",
  "target_step_id": "FED_HOST_DOCUMENTS",
  "target_step_version": 2,
  "version": 1,
  "status": "draft",
  "applicability": {
    "op": "all",
    "args": [
      {
        "op": "all",
        "args": [
          {
            "op": "eq",
            "fact": "spbu_campus",
            "value": "main"
          },
          {
            "op": "eq",
            "fact": "spbu_own_dormitory",
            "value": true
          }
        ]
      },
      {
        "op": "eq",
        "fact": "accommodation_type",
        "value": "dormitory"
      }
    ]
  },
  "effective_period": {},
  "additions": {
    "instructions": [
      "Передайте комплект в УМиРР по закреплённой площадке приёма."
    ],
    "destination": {
      "kind": "online",
      "name": "Управление по миграционной и регистрационной работе СПбГУ",
      "url": "https://guide.spbu.ru/foreigner",
      "contacts": [
        {
          "kind": "email",
          "value": "pvo@spbu.ru",
          "label": "УМиРР"
        }
      ],
      "appointment_required": "unknown"
    },
    "warnings": [
      {
        "id": "WARN_OVR_SPBU_HOST_DOCUMENTS",
        "severity": "blocking",
        "message": "Локальная инструкция ограничена указанным контекстом; нерешённые детали перечислены отдельно.",
        "unresolved_ids": [
          "UNR_SPBU_HOST_DOCUMENTS"
        ]
      }
    ],
    "documents": [
      {
        "id": "DOC_OVR_SPBU_HOST_DOCUMENTS_1",
        "title": "Договор найма комнаты",
        "requirement": "required",
        "form": "unspecified",
        "evidence": [
          {
            "source_id": "SRC_SPBU_GUIDE",
            "locator": "Иностранцам: миграционный учёт / приглашения",
            "supports": "Локальный комплект из указанного раздела."
          }
        ]
      },
      {
        "id": "DOC_OVR_SPBU_HOST_DOCUMENTS_2",
        "title": "Паспорт и копия страниц с отметками",
        "requirement": "required",
        "form": "unspecified",
        "evidence": [
          {
            "source_id": "SRC_SPBU_GUIDE",
            "locator": "Иностранцам: миграционный учёт / приглашения",
            "supports": "Локальный комплект из указанного раздела."
          }
        ]
      },
      {
        "id": "DOC_OVR_SPBU_HOST_DOCUMENTS_3",
        "title": "Миграционная карта и копия",
        "requirement": "conditional",
        "form": "unspecified",
        "evidence": [
          {
            "source_id": "SRC_SPBU_GUIDE",
            "locator": "Иностранцам: миграционный учёт / приглашения",
            "supports": "Локальный комплект из указанного раздела."
          }
        ],
        "condition": {
          "op": "eq",
          "fact": "migration_card_required",
          "value": true
        }
      }
    ],
    "local_deadlines": [
      {
        "id": "LD_OVR_SPBU_HOST_DOCUMENTS",
        "scope": "university_internal",
        "title": "Передача документов в университет",
        "applicability": {
          "op": "always"
        },
        "reported_text": "Три рабочих дня от даты въезда",
        "state": "partial",
        "deadline": {
          "kind": "partial",
          "known": {
            "amount": 3,
            "unit": "business_day",
            "direction": "after",
            "anchor_description": "Въезд в РФ",
            "actor": "student",
            "legal_text": "Внутренний срок университета, не федеральная норма."
          },
          "calculation_allowed": false,
          "unresolved_ids": [
            "UNR_SPBU_HOST_DOCUMENTS"
          ]
        },
        "source_id": "SRC_SPBU_GUIDE",
        "locator": "Иностранцам: миграционный учёт / приглашения",
        "checked_on": "2026-09-26"
      }
    ]
  },
  "evidence": [
    {
      "source_id": "SRC_SPBU_GUIDE",
      "locator": "Иностранцам: миграционный учёт / приглашения",
      "supports": "Перечисленные локальные действия и реквизиты; федеральный нормативный срок этим источником не устанавливается.",
      "fields": [
        "/additions/instructions",
        "/additions/destination",
        "/additions/documents"
      ],
      "checked_on": "2026-09-26",
      "support_level": "partial"
    }
  ],
  "unresolved_ids": [
    "UNR_SPBU_HOST_DOCUMENTS"
  ],
  "review": {
    "reviewed_at": "2026-09-26T11:34:43.776826Z",
    "reviewer": "Новое последовательное исследование официальных ресурсов",
    "next_review_on": "2026-10-26"
  }
}
