{
  "schema_version": "1.1.0",
  "id": "OVR_SPBU_INVITATION_REQUEST",
  "university_id": "UNIV_SPBU",
  "target_step_id": "FED_INVITATION_REQUEST",
  "target_step_version": 3,
  "version": 1,
  "status": "draft",
  "applicability": {
    "op": "all",
    "args": [
      {
        "op": "eq",
        "fact": "spbu_campus",
        "value": "main"
      },
      {
        "op": "always"
      }
    ]
  },
  "effective_period": {},
  "additions": {
    "instructions": [
      "Подайте запрос через учебный отдел своей программы или личный кабинет; поступающим на первый курс — через комиссию по приёму иностранных граждан."
    ],
    "destination": {
      "kind": "online",
      "name": "Управление по миграционной и регистрационной работе СПбГУ",
      "url": "https://guide.spbu.ru/foreigner",
      "contacts": [
        {
          "kind": "email",
          "value": "pvo@spbu.ru",
          "label": "УМиРР"
        }
      ],
      "appointment_required": "unknown"
    },
    "warnings": [
      {
        "id": "WARN_OVR_SPBU_INVITATION_REQUEST",
        "severity": "blocking",
        "message": "Локальная инструкция ограничена указанным контекстом; нерешённые детали перечислены отдельно.",
        "unresolved_ids": [
          "UNR_SPBU_INVITATION_REQUEST"
        ]
      }
    ]
  },
  "evidence": [
    {
      "source_id": "SRC_SPBU_GUIDE",
      "locator": "Иностранцам: миграционный учёт / приглашения",
      "supports": "Перечисленные локальные действия и реквизиты; федеральный нормативный срок этим источником не устанавливается.",
      "fields": [
        "/additions/instructions",
        "/additions/destination"
      ],
      "checked_on": "2026-09-26",
      "support_level": "partial"
    }
  ],
  "unresolved_ids": [
    "UNR_SPBU_INVITATION_REQUEST"
  ],
  "review": {
    "reviewed_at": "2026-09-26T11:34:43.776826Z",
    "reviewer": "Новое последовательное исследование официальных ресурсов",
    "next_review_on": "2026-10-26"
  }
}
