{
  "schema_version": "1.1.0",
  "id": "OVR_ITMO_STUDY_VISA_EXTEND",
  "university_id": "UNIV_ITMO",
  "target_step_id": "FED_STUDY_VISA_EXTEND",
  "target_step_version": 2,
  "version": 2,
  "status": "draft",
  "applicability": {
    "op": "always"
  },
  "effective_period": {},
  "additions": {
    "instructions": [
      "Пакет на продление визы передайте ОМУ; платежные реквизиты получите там же."
    ],
    "destination": {
      "kind": "physical",
      "name": "Отдел миграционного учета ИТМО",
      "address": "Санкт-Петербург, ул. Ломоносова, 9, кабинет 2139d",
      "contacts": [
        {
          "kind": "email",
          "value": "omu@itmo.ru",
          "label": "ОМУ"
        },
        {
          "kind": "phone",
          "value": "+7 (812) 480-09-17",
          "label": "ОМУ; подтверждено двумя русскими страницами"
        }
      ],
      "appointment_required": "unknown"
    },
    "warnings": [
      {
        "id": "WARN_ITMO_STUDY_VISA_EXTEND",
        "severity": "blocking",
        "message": "Сохранена подтвержденная местная часть; недостающие детали требуют уточнения.",
        "unresolved_ids": [
          "UNR_ITMO_STUDY_VISA_EXTEND"
        ]
      },
      {
        "id": "WARN_ITMO_LOCAL_TIME",
        "severity": "blocking",
        "message": "Не опубликованы полные правила отсчета внутренних сроков, часы окончания приема и календарь. «45 дней» не превращать в рабочие дни, а «1,5 месяца» — автоматически в 45 дней.",
        "unresolved_ids": [
          "UNR_ITMO_LOCAL_TIME"
        ]
      },
      {
        "id": "WARN_ITMO_FEDERAL_MEDICAL_CONFLICT",
        "severity": "blocking",
        "message": "Страница ИТМО объединяет медосмотр и дактилоскопию под общим сроком 30 дней. Федеральный слой содержит отдельные основания и сроки. Вузовская страница используется только для локального адреса и передачи документов; правовая коллизия не разрешена.",
        "unresolved_ids": [
          "UNR_ITMO_FEDERAL_MEDICAL_CONFLICT"
        ]
      },
      {
        "id": "WARN_ITMO_CONTACT_VARIANTS",
        "severity": "blocking",
        "message": "Телефон ОМУ на актуальной странице и странице отчисления: +7 (812) 480-09-17; английский гайд содержит +7 (812) 607-04-60. Выбран подтвержденный двумя русскими страницами контакт, альтернативный номер не включен в рабочие контакты. Часы приема и запись не подтверждены.",
        "unresolved_ids": [
          "UNR_ITMO_CONTACT_VARIANTS"
        ]
      }
    ],
    "documents": [
      {
        "id": "DOC_ITMO_VISA_PHOTO",
        "title": "Фотография 3 × 4 см",
        "requirement": "required",
        "form": "unspecified",
        "evidence": [
          {
            "source_id": "SRC_ITMO_MIGRATION",
            "locator": "Перечень документов соответствующей локальной процедуры",
            "supports": "Локальная позиция перечня."
          }
        ]
      },
      {
        "id": "DOC_ITMO_VISA_RECEIPT",
        "title": "Квитанция госпошлины по реквизитам ОМУ",
        "requirement": "required",
        "form": "unspecified",
        "evidence": [
          {
            "source_id": "SRC_ITMO_MIGRATION",
            "locator": "Перечень документов соответствующей локальной процедуры",
            "supports": "Локальная позиция перечня."
          }
        ]
      },
      {
        "id": "DOC_ITMO_VISA_PAID_CONTRACT",
        "title": "Договор платного обучения",
        "requirement": "conditional",
        "form": "unspecified",
        "evidence": [
          {
            "source_id": "SRC_ITMO_MIGRATION",
            "locator": "Перечень документов соответствующей локальной процедуры",
            "supports": "Локальная позиция перечня."
          }
        ],
        "condition": {
          "op": "eq",
          "fact": "itmo_paid_education",
          "value": true
        }
      },
      {
        "id": "DOC_ITMO_VISA_MEDICAL",
        "title": "Медицинское заключение и подтверждение внесения данных",
        "requirement": "conditional",
        "form": "unspecified",
        "evidence": [
          {
            "source_id": "SRC_ITMO_MIGRATION",
            "locator": "Перечень документов соответствующей локальной процедуры",
            "supports": "Локальная позиция перечня."
          }
        ],
        "condition": {
          "op": "eq",
          "fact": "medical_exam_required",
          "value": true
        }
      },
      {
        "id": "DOC_ITMO_VISA_FINGERPRINT",
        "title": "Карта дактилоскопии",
        "requirement": "conditional",
        "form": "unspecified",
        "evidence": [
          {
            "source_id": "SRC_ITMO_MIGRATION",
            "locator": "Перечень документов соответствующей локальной процедуры",
            "supports": "Локальная позиция перечня."
          }
        ],
        "condition": {
          "op": "eq",
          "fact": "fingerprint_required",
          "value": true
        }
      },
      {
        "id": "DOC_ITMO_STUDY_VISA_EXTEND_ARRIVAL_PROOF",
        "title": "Действующая отрывная часть уведомления о прибытии",
        "requirement": "required",
        "form": "original",
        "evidence": [
          {
            "source_id": "SRC_ITMO_MIGRATION",
            "locator": "Продление срока пребывания / Продление визы",
            "supports": "Позиция локального пакета, отсутствующая в федеральном списке."
          }
        ]
      },
      {
        "id": "DOC_ITMO_STUDY_VISA_EXTEND_MIGRATION_CARD",
        "title": "Миграционная карта при обязанности иметь ее",
        "requirement": "conditional",
        "form": "original",
        "evidence": [
          {
            "source_id": "SRC_ITMO_MIGRATION",
            "locator": "Продление срока пребывания / Продление визы",
            "supports": "Позиция локального пакета, отсутствующая в федеральном списке."
          }
        ],
        "condition": {
          "op": "eq",
          "fact": "migration_card_required",
          "value": true
        }
      }
    ],
    "local_deadlines": [
      {
        "id": "LD_ITMO_VISA",
        "scope": "university_internal",
        "title": "Передача документов на визу",
        "applicability": {
          "op": "always"
        },
        "reported_text": "За 1,5 месяца до окончания визы",
        "state": "partial",
        "deadline": {
          "kind": "unknown",
          "unresolved_ids": [
            "UNR_ITMO_LOCAL_TIME"
          ]
        },
        "source_id": "SRC_ITMO_MIGRATION",
        "locator": "Локальная инструкция на официальной странице ИТМО",
        "checked_on": "2026-09-26"
      }
    ]
  },
  "evidence": [
    {
      "source_id": "SRC_ITMO_MIGRATION",
      "locator": "Продление визы: 1,5 месяца, комплект документов и получение реквизитов; контакты ответственного подразделения на странице источника",
      "supports": "Сопоставление перечисленных локальных полей с разделом страницы. Это не подтверждение федеральных оснований и не закрытие локальных пробелов.",
      "fields": [
        "/additions/instructions/0",
        "/additions/destination",
        "/additions/documents/0",
        "/additions/documents/1",
        "/additions/documents/2",
        "/additions/documents/3",
        "/additions/documents/4",
        "/additions/documents/5",
        "/additions/documents/6"
      ],
      "checked_on": "2026-09-26",
      "support_level": "partial"
    }
  ],
  "unresolved_ids": [
    "UNR_ITMO_STUDY_VISA_EXTEND",
    "UNR_ITMO_LOCAL_TIME",
    "UNR_ITMO_FEDERAL_MEDICAL_CONFLICT",
    "UNR_ITMO_CONTACT_VARIANTS"
  ],
  "review": {
    "reviewed_at": "2026-09-26T11:40:30.570901Z",
    "reviewer": "Повторное самостоятельное исследование официальных страниц в последовательном обзоре десяти вузов",
    "next_review_on": "2026-10-26"
  }
}
