{
  "schema_version": "1.1.0",
  "id": "OVR_HSE_MOSCOW_NEW_PASSPORT",
  "university_id": "UNIV_HSE",
  "target_step_id": "FED_ACCOUNTING_DATA_UPDATE",
  "target_step_version": 2,
  "version": 1,
  "status": "draft",
  "applicability": {
    "op": "all",
    "args": [
      {
        "op": "eq",
        "fact": "hse_campus",
        "value": "main"
      },
      {
        "op": "eq",
        "fact": "full_time",
        "value": true
      }
    ]
  },
  "effective_period": {},
  "additions": {
    "instructions": [
      "Предъявите новый паспорт и подтверждение даты его получения визовому центру; копии передайте принимающей стороне."
    ],
    "destination": {
      "kind": "hybrid",
      "name": "Визовый центр ВШЭ — Москва; приём через Центр сервиса «Студент»",
      "url": "https://ivisa.hse.ru/",
      "contacts": [
        {
          "kind": "email",
          "value": "visa-registration@hse.ru",
          "label": "Визовый центр ВШЭ — Москва; приём через Центр сервиса «Студент»"
        },
        {
          "kind": "phone",
          "value": "+7 (495) 531-00-63",
          "label": "Визовый центр ВШЭ — Москва; приём через Центр сервиса «Студент»"
        }
      ],
      "appointment_required": "unknown",
      "address": "Москва, Покровский бульвар, 11; центр D007, документы — Центр сервиса «Студент»"
    },
    "warnings": [
      {
        "id": "WARN_OVR_HSE_MOSCOW_NEW_PASSPORT",
        "severity": "blocking",
        "message": "Локальная инструкция ограничена указанным контекстом; нерешённые детали перечислены отдельно.",
        "unresolved_ids": [
          "UNR_HSE_MOSCOW_NEW_PASSPORT"
        ]
      }
    ],
    "local_deadlines": [
      {
        "id": "LD_OVR_HSE_MOSCOW_NEW_PASSPORT",
        "scope": "university_internal",
        "title": "Передача документов в университет",
        "applicability": {
          "op": "always"
        },
        "reported_text": "Безвизовая инструкция: в день получения; визовый FAQ: три рабочих дня.",
        "state": "unknown",
        "deadline": {
          "kind": "unknown",
          "unresolved_ids": [
            "UNR_HSE_MOSCOW_NEW_PASSPORT"
          ]
        },
        "source_id": "SRC_HSE_STAY",
        "locator": "Профильный раздел указанной страницы",
        "checked_on": "2026-09-26"
      }
    ]
  },
  "evidence": [
    {
      "source_id": "SRC_HSE_STAY",
      "locator": "Профильный раздел указанной страницы",
      "supports": "Перечисленные локальные действия и реквизиты; федеральный нормативный срок этим источником не устанавливается.",
      "fields": [
        "/additions/instructions",
        "/additions/destination"
      ],
      "checked_on": "2026-09-26",
      "support_level": "partial"
    },
    {
      "source_id": "SRC_HSE_CENTER",
      "locator": "Профильный раздел указанной страницы",
      "supports": "Перечисленные локальные действия и реквизиты; федеральный нормативный срок этим источником не устанавливается.",
      "fields": [
        "/additions/instructions",
        "/additions/destination"
      ],
      "checked_on": "2026-09-26",
      "support_level": "partial"
    }
  ],
  "unresolved_ids": [
    "UNR_HSE_MOSCOW_NEW_PASSPORT"
  ],
  "review": {
    "reviewed_at": "2026-09-26T11:26:55.858077Z",
    "reviewer": "Новое последовательное исследование официальных ресурсов",
    "next_review_on": "2026-10-26"
  }
}
