{
  "schema_version": "1.1.0",
  "id": "OVR_RUDN_SNILS_REGISTER",
  "university_id": "UNIV_RUDN",
  "target_step_id": "FED_SNILS_REGISTER",
  "target_step_version": 3,
  "version": 1,
  "status": "draft",
  "applicability": {
    "op": "all",
    "args": [
      {
        "op": "eq",
        "fact": "rudn_campus",
        "value": "main"
      },
      {
        "op": "always"
      }
    ]
  },
  "effective_period": {},
  "additions": {
    "instructions": [
      "В кабинете выберите «МФЦ → Заявления → Оформление СНИЛС», проверьте паспортные сведения, прикрепите сканы. После уведомления подпишите согласие в «Моих обращениях»; там же получите результат."
    ],
    "destination": {
      "kind": "hybrid",
      "name": "МФЦ РУДН",
      "address": "Москва, ул. Миклухо-Маклая, 6, цокольный этаж",
      "url": "https://lk.rudn.ru/",
      "contacts": [
        {
          "kind": "email",
          "value": "mfc@rudn.ru",
          "label": "МФЦ РУДН"
        }
      ],
      "appointment_required": "yes"
    },
    "warnings": [
      {
        "id": "WARN_OVR_RUDN_SNILS_REGISTER",
        "severity": "blocking",
        "message": "Локальная инструкция ограничена указанным контекстом; нерешённые детали перечислены отдельно.",
        "unresolved_ids": [
          "UNR_RUDN_SNILS_REGISTER"
        ]
      }
    ],
    "documents": [
      {
        "id": "DOC_OVR_RUDN_SNILS_REGISTER_1",
        "title": "Удостоверение личности",
        "requirement": "required",
        "form": "unspecified",
        "evidence": [
          {
            "source_id": "SRC_RUDN_SNILS",
            "locator": "Как заказать и получить услугу",
            "supports": "Локальный комплект из указанного раздела."
          }
        ]
      },
      {
        "id": "DOC_OVR_RUDN_SNILS_REGISTER_2",
        "title": "Нотариальный перевод",
        "requirement": "required",
        "form": "unspecified",
        "evidence": [
          {
            "source_id": "SRC_RUDN_SNILS",
            "locator": "Как заказать и получить услугу",
            "supports": "Локальный комплект из указанного раздела."
          }
        ]
      },
      {
        "id": "DOC_OVR_RUDN_SNILS_REGISTER_3",
        "title": "Регистрация",
        "requirement": "required",
        "form": "unspecified",
        "evidence": [
          {
            "source_id": "SRC_RUDN_SNILS",
            "locator": "Как заказать и получить услугу",
            "supports": "Локальный комплект из указанного раздела."
          }
        ]
      }
    ]
  },
  "evidence": [
    {
      "source_id": "SRC_RUDN_SNILS",
      "locator": "Как заказать и получить услугу",
      "supports": "Перечисленные локальные действия и реквизиты; федеральный нормативный срок этим источником не устанавливается.",
      "fields": [
        "/additions/instructions",
        "/additions/destination",
        "/additions/documents"
      ],
      "checked_on": "2026-09-26",
      "support_level": "partial"
    },
    {
      "source_id": "SRC_RUDN_MFC",
      "locator": "Как заказать и получить услугу",
      "supports": "Перечисленные локальные действия и реквизиты; федеральный нормативный срок этим источником не устанавливается.",
      "fields": [
        "/additions/instructions",
        "/additions/destination",
        "/additions/documents"
      ],
      "checked_on": "2026-09-26",
      "support_level": "partial"
    }
  ],
  "unresolved_ids": [
    "UNR_RUDN_SNILS_REGISTER"
  ],
  "review": {
    "reviewed_at": "2026-09-26T11:47:31.010529Z",
    "reviewer": "Новое последовательное исследование официальных ресурсов",
    "next_review_on": "2026-10-26"
  }
}
