{
  "schema_version": "1.1.0",
  "id": "OVR_TSU_STUDY_VISA_EXTEND",
  "university_id": "UNIV_TSU",
  "target_step_id": "FED_STUDY_VISA_EXTEND",
  "target_step_version": 2,
  "version": 1,
  "status": "draft",
  "applicability": {
    "op": "all",
    "args": [
      {
        "op": "eq",
        "fact": "tsu_campus",
        "value": "main"
      },
      {
        "op": "always"
      }
    ]
  },
  "effective_period": {},
  "additions": {
    "instructions": [
      "Лично подайте визовый комплект в кабинет 327."
    ],
    "destination": {
      "kind": "hybrid",
      "name": "Отдел визового сопровождения ТГУ",
      "address": "Томск, пр. Ленина, 36, главный корпус, кабинет 327",
      "url": "https://tsu.ru/university/structure/upravl/inter_upr.php?nv=on",
      "contacts": [
        {
          "kind": "email",
          "value": "visa@mail.tsu.ru",
          "label": "Визовое сопровождение"
        },
        {
          "kind": "phone",
          "value": "+7 (3822) 526-945",
          "label": "Визовое сопровождение"
        }
      ],
      "appointment_required": "unknown"
    },
    "warnings": [
      {
        "id": "WARN_OVR_TSU_STUDY_VISA_EXTEND",
        "severity": "blocking",
        "message": "Локальная инструкция ограничена указанным контекстом; нерешённые детали перечислены отдельно.",
        "unresolved_ids": [
          "UNR_TSU_STUDY_VISA_EXTEND"
        ]
      }
    ],
    "documents": [
      {
        "id": "DOC_OVR_TSU_STUDY_VISA_EXTEND_1",
        "title": "Паспорт с копиями использованных страниц",
        "requirement": "required",
        "form": "unspecified",
        "evidence": [
          {
            "source_id": "SRC_TSU_VISA",
            "locator": "Visa Support: раздел для студентов",
            "supports": "Локальный комплект из указанного раздела."
          }
        ]
      },
      {
        "id": "DOC_OVR_TSU_STUDY_VISA_EXTEND_2",
        "title": "Миграционная карта и копия",
        "requirement": "conditional",
        "form": "unspecified",
        "evidence": [
          {
            "source_id": "SRC_TSU_VISA",
            "locator": "Visa Support: раздел для студентов",
            "supports": "Локальный комплект из указанного раздела."
          }
        ],
        "condition": {
          "op": "eq",
          "fact": "migration_card_required",
          "value": true
        }
      },
      {
        "id": "DOC_OVR_TSU_STUDY_VISA_EXTEND_3",
        "title": "Подтверждение учёта и копия",
        "requirement": "required",
        "form": "unspecified",
        "evidence": [
          {
            "source_id": "SRC_TSU_VISA",
            "locator": "Visa Support: раздел для студентов",
            "supports": "Локальный комплект из указанного раздела."
          }
        ]
      },
      {
        "id": "DOC_OVR_TSU_STUDY_VISA_EXTEND_4",
        "title": "Справка об обучении",
        "requirement": "required",
        "form": "unspecified",
        "evidence": [
          {
            "source_id": "SRC_TSU_VISA",
            "locator": "Visa Support: раздел для студентов",
            "supports": "Локальный комплект из указанного раздела."
          }
        ]
      },
      {
        "id": "DOC_OVR_TSU_STUDY_VISA_EXTEND_5",
        "title": "Договор обучения либо направление Минобрнауки и приказ о зачислении",
        "requirement": "required",
        "form": "unspecified",
        "evidence": [
          {
            "source_id": "SRC_TSU_VISA",
            "locator": "Visa Support: раздел для студентов",
            "supports": "Локальный комплект из указанного раздела."
          }
        ]
      },
      {
        "id": "DOC_OVR_TSU_STUDY_VISA_EXTEND_6",
        "title": "Подтверждение оплаты актуальной пошлины",
        "requirement": "required",
        "form": "unspecified",
        "evidence": [
          {
            "source_id": "SRC_TSU_VISA",
            "locator": "Visa Support: раздел для студентов",
            "supports": "Локальный комплект из указанного раздела."
          }
        ]
      },
      {
        "id": "DOC_OVR_TSU_STUDY_VISA_EXTEND_7",
        "title": "Две матовые фотографии 3×4",
        "requirement": "required",
        "form": "unspecified",
        "evidence": [
          {
            "source_id": "SRC_TSU_VISA",
            "locator": "Visa Support: раздел для студентов",
            "supports": "Локальный комплект из указанного раздела."
          }
        ]
      }
    ],
    "local_deadlines": [
      {
        "id": "LD_OVR_TSU_STUDY_VISA_EXTEND",
        "scope": "university_internal",
        "title": "Передача документов в университет",
        "applicability": {
          "op": "always"
        },
        "reported_text": "Документы принимаются минимум за 50 дней до истечения визы",
        "state": "unknown",
        "deadline": {
          "kind": "unknown",
          "unresolved_ids": [
            "UNR_TSU_STUDY_VISA_EXTEND"
          ]
        },
        "source_id": "SRC_TSU_VISA",
        "locator": "Visa Support: раздел для студентов",
        "checked_on": "2026-09-26"
      }
    ]
  },
  "evidence": [
    {
      "source_id": "SRC_TSU_VISA",
      "locator": "Visa Support: раздел для студентов",
      "supports": "Перечисленные локальные действия и реквизиты; федеральный нормативный срок этим источником не устанавливается.",
      "fields": [
        "/additions/instructions",
        "/additions/destination",
        "/additions/documents"
      ],
      "checked_on": "2026-09-26",
      "support_level": "partial"
    },
    {
      "source_id": "SRC_TSU_CONTACT",
      "locator": "Visa Support: раздел для студентов",
      "supports": "Перечисленные локальные действия и реквизиты; федеральный нормативный срок этим источником не устанавливается.",
      "fields": [
        "/additions/instructions",
        "/additions/destination",
        "/additions/documents"
      ],
      "checked_on": "2026-09-26",
      "support_level": "partial"
    }
  ],
  "unresolved_ids": [
    "UNR_TSU_STUDY_VISA_EXTEND"
  ],
  "review": {
    "reviewed_at": "2026-09-26T11:37:54.661491Z",
    "reviewer": "Новое последовательное исследование официальных ресурсов",
    "next_review_on": "2026-10-26"
  }
}
